{
  "$schema": "https://vomaste.cz/schemas/canonical/case.schema.json",
  "schemaVersion": 1,
  "@context": "https://vomaste.cz/context/v1.jsonld",
  "@id": "https://vomaste.cz/id/dossiers/macinka-turek/cases/CASE-01",
  "@type": "vomaste:Case",
  "recordType": "case",
  "identifier": "CASE-01",
  "dossier": {
    "@id": "https://vomaste.cz/id/dossiers/macinka-turek"
  },
  "title": "Fotografie a sbírka svícnů",
  "summary": "Fotografie připomínající nacistický pozdrav a sbírka svícnů s hákovými kříži. Turek: „špatný humor.“",
  "period": "2024",
  "status": "status-disputed",
  "statusLabel": "Fotografie: odloženo pro promlčení",
  "anchor": "kauza-z-roku-2024-fotografie-a-sbirka-svicnu",
  "claims": [
    {
      "@id": "https://vomaste.cz/id/dossiers/macinka-turek/claims/CLM-04"
    },
    {
      "@id": "https://vomaste.cz/id/dossiers/macinka-turek/claims/CLM-05"
    },
    {
      "@id": "https://vomaste.cz/id/dossiers/macinka-turek/claims/CLM-06"
    },
    {
      "@id": "https://vomaste.cz/id/dossiers/macinka-turek/claims/CLM-45"
    }
  ],
  "sources": [
    {
      "@id": "https://vomaste.cz/id/dossiers/macinka-turek/sources/SRC-12"
    },
    {
      "@id": "https://vomaste.cz/id/dossiers/macinka-turek/sources/SRC-14"
    },
    {
      "@id": "https://vomaste.cz/id/dossiers/macinka-turek/sources/SRC-53"
    }
  ],
  "subjects": [
    "macinka",
    "turek"
  ],
  "content": [
    {
      "type": "markdown",
      "value": "Plné znění, zdroje a kontext tohoto tématu jsou v [hlavním přehledu\ndossieru](@/dossiers/macinka-turek/_index.md#kauza-z-roku-2024-fotografie-a-sbirka-svicnu)."
    }
  ],
  "order": 1
}
