{
  "$schema": "https://vomaste.cz/schemas/canonical/case.schema.json",
  "schemaVersion": 1,
  "@context": "https://vomaste.cz/context/v1.jsonld",
  "@id": "https://vomaste.cz/id/dossiers/andrej-babis/cases/CASE-11",
  "@type": "vomaste:Case",
  "recordType": "case",
  "identifier": "CASE-11",
  "dossier": {
    "@id": "https://vomaste.cz/id/dossiers/andrej-babis"
  },
  "title": "PGRLF: žaloby na 28 společností skupiny",
  "summary": "Podpůrný a garanční rolnický a lesnický fond podal 20. 7. 2026 žaloby na 28 firem, které byly v rozhodném období součástí koncernu Agrofert, o vrácení podpor v souhrnné výši 22 milionů korun poskytnutých v letech 2017–2021, s odkazem na rozpor s pravidly střetu zájmů; výzvě k dobrovolnému vrácení firmy nevyhověly. Jde o civilní vymáhání proti společnostem, nikoli o obžalobu Andreje Babiše, a podaná žaloba není rozhodnutí soudu; Agrofert nároky odmítá.",
  "period": "2026–",
  "status": "status-disputed",
  "statusLabel": "Podané žaloby — soud o nich nerozhodl",
  "anchor": "kauza-pgrlf",
  "claims": [
    {
      "@id": "https://vomaste.cz/id/dossiers/andrej-babis/claims/CLM-60"
    },
    {
      "@id": "https://vomaste.cz/id/dossiers/andrej-babis/claims/CLM-61"
    }
  ],
  "sources": [
    {
      "@id": "https://vomaste.cz/id/dossiers/andrej-babis/sources/SRC-38"
    },
    {
      "@id": "https://vomaste.cz/id/dossiers/andrej-babis/sources/SRC-39"
    },
    {
      "@id": "https://vomaste.cz/id/dossiers/andrej-babis/sources/SRC-40"
    }
  ],
  "subjects": [],
  "content": [
    {
      "type": "markdown",
      "value": "Plné znění, zdroje a kontext tohoto případu jsou v [hlavním přehledu\ndossieru](@/dossiers/andrej-babis/_index.md#kauza-pgrlf)."
    }
  ],
  "order": 11
}
