{
  "$schema": "https://vomaste.cz/schemas/canonical/case.schema.json",
  "schemaVersion": 1,
  "@context": "https://vomaste.cz/context/v1.jsonld",
  "@id": "https://vomaste.cz/id/dossiers/jeronym-tejc/cases/CASE-03",
  "@type": "vomaste:Case",
  "recordType": "case",
  "identifier": "CASE-03",
  "dossier": {
    "@id": "https://vomaste.cz/id/dossiers/jeronym-tejc"
  },
  "title": "Spor o předběžné opatření Ústavního soudu",
  "summary": "Spor o předběžné opatření Ústavního soudu — Tejcovo zpochybnění předběžného opatření umožňujícího prezidentu Pavlovi rozhodnutí, jeho rozlišení mezi zákazem jednání a nařizováním aktivních kroků, vládní návrh na zamítnutí kompetenční žaloby a na vyloučení soudce zpravodaje Pavla Šámala, a Tejcova kritika, že vláda neměla možnost se k opatření předem vyjádřit.",
  "period": "2026",
  "status": "status-single",
  "statusLabel": "Sledované téma",
  "anchor": "kauza-ustavni-soud",
  "claims": [
    {
      "@id": "https://vomaste.cz/id/dossiers/jeronym-tejc/claims/CLM-14"
    },
    {
      "@id": "https://vomaste.cz/id/dossiers/jeronym-tejc/claims/CLM-15"
    },
    {
      "@id": "https://vomaste.cz/id/dossiers/jeronym-tejc/claims/CLM-16"
    },
    {
      "@id": "https://vomaste.cz/id/dossiers/jeronym-tejc/claims/CLM-17"
    },
    {
      "@id": "https://vomaste.cz/id/dossiers/jeronym-tejc/claims/CLM-18"
    },
    {
      "@id": "https://vomaste.cz/id/dossiers/jeronym-tejc/claims/CLM-41"
    },
    {
      "@id": "https://vomaste.cz/id/dossiers/jeronym-tejc/claims/CLM-42"
    },
    {
      "@id": "https://vomaste.cz/id/dossiers/jeronym-tejc/claims/CLM-43"
    },
    {
      "@id": "https://vomaste.cz/id/dossiers/jeronym-tejc/claims/CLM-44"
    },
    {
      "@id": "https://vomaste.cz/id/dossiers/jeronym-tejc/claims/CLM-45"
    },
    {
      "@id": "https://vomaste.cz/id/dossiers/jeronym-tejc/claims/CLM-46"
    },
    {
      "@id": "https://vomaste.cz/id/dossiers/jeronym-tejc/claims/CLM-47"
    },
    {
      "@id": "https://vomaste.cz/id/dossiers/jeronym-tejc/claims/CLM-48"
    },
    {
      "@id": "https://vomaste.cz/id/dossiers/jeronym-tejc/claims/CLM-49"
    },
    {
      "@id": "https://vomaste.cz/id/dossiers/jeronym-tejc/claims/CLM-50"
    },
    {
      "@id": "https://vomaste.cz/id/dossiers/jeronym-tejc/claims/CLM-51"
    }
  ],
  "sources": [
    {
      "@id": "https://vomaste.cz/id/dossiers/jeronym-tejc/sources/SRC-08"
    },
    {
      "@id": "https://vomaste.cz/id/dossiers/jeronym-tejc/sources/SRC-09"
    },
    {
      "@id": "https://vomaste.cz/id/dossiers/jeronym-tejc/sources/SRC-10"
    },
    {
      "@id": "https://vomaste.cz/id/dossiers/jeronym-tejc/sources/SRC-21"
    },
    {
      "@id": "https://vomaste.cz/id/dossiers/jeronym-tejc/sources/SRC-22"
    },
    {
      "@id": "https://vomaste.cz/id/dossiers/jeronym-tejc/sources/SRC-23"
    },
    {
      "@id": "https://vomaste.cz/id/dossiers/jeronym-tejc/sources/SRC-24"
    },
    {
      "@id": "https://vomaste.cz/id/dossiers/jeronym-tejc/sources/SRC-25"
    },
    {
      "@id": "https://vomaste.cz/id/dossiers/jeronym-tejc/sources/SRC-31"
    }
  ],
  "subjects": [
    "tejc"
  ],
  "content": [
    {
      "type": "markdown",
      "value": "Plné znění, zdroje a kontext tohoto tématu jsou v [hlavním přehledu\ndossieru](@/dossiers/jeronym-tejc/_index.md#kauza-ustavni-soud)."
    }
  ],
  "order": 3
}
